{
   "$schema": "http://json-schema.org/draft-07/schema",
   "type": "object",
   "properties": {
      "background": {
         "type": "string"
      },
      "face": {
         "type": "string",
         "enum": [
            "down",
            "left",
            "right",
            "up"
         ]
      },
      "layers": {
         "type": "object",
         "additionalProperties": {
            "type": "array",
            "items": {
               "type": "object",
               "properties": {
                  "attachments": {
                     "type": "array",
                     "items": {
                        "oneOf": [
                           {
                              "type": "object",
                              "required": [
                                 "type"
                              ],
                              "properties": {
                                 "anchor": {
                                    "$ref": "./vector.schema.json"
                                 },
                                 "active": {
                                    "type": "boolean"
                                 },
                                 "filters": {
                                    "type": "array",
                                    "items": {
                                       "type": "string"
                                    }
                                 },
                                 "resources": {
                                    "type": "string"
                                 },
                                 "position": {
                                    "$ref": "./vector.schema.json"
                                 },
                                 "rotation": {
                                    "type": "number"
                                 },
                                 "type": {
                                    "enum": [
                                       "animation"
                                    ]
                                 }
                              }
                           },
                           {
                              "type": "object",
                              "required": [
                                 "type"
                              ],
                              "properties": {
                                 "anchor": {
                                    "$ref": "./vector.schema.json"
                                 },
                                 "active": {
                                    "type": "boolean"
                                 },
                                 "filters": {
                                    "type": "array",
                                    "items": {
                                       "type": "string"
                                    }
                                 },
                                 "frames": {
                                    "type": "array",
                                    "items": {
                                       "type": "string"
                                    }
                                 },
                                 "position": {
                                    "$ref": "./vector.schema.json"
                                 },
                                 "rotation": {
                                    "type": "number"
                                 },
                                 "steps": {
                                    "type": "number"
                                 },
                                 "type": {
                                    "enum": [
                                       "sprite"
                                    ]
                                 }
                              }
                           }
                        ]
                     }
                  },
                  "barriers": {
                     "type": "array",
                     "items": {
                        "type": "object",
                        "properties": {
                           "anchor": {
                              "$ref": "./vector.schema.json"
                           },
                           "position": {
                              "$ref": "./vector.schema.json"
                           },
                           "rotation": {
                              "type": "number"
                           },
                           "size": {
                              "$ref": "./vector.schema.json"
                           }
                        }
                     }
                  },
                  "filters": {
                     "type": "array",
                     "items": {
                        "type": "string"
                     }
                  },
                  "interacts": {
                     "type": "array",
                     "items": {
                        "type": "object",
                        "properties": {
                           "anchor": {
                              "$ref": "./vector.schema.json"
                           },
                           "args": {
                              "type": "array",
                              "items": {
                                 "type": "string"
                              }
                           },
                           "name": {
                              "type": "string"
                           },
                           "position": {
                              "$ref": "./vector.schema.json"
                           },
                           "rotation": {
                              "type": "number"
                           },
                           "size": {
                              "$ref": "./vector.schema.json"
                           }
                        }
                     }
                  },
                  "position": {
                     "$ref": "./vector.schema.json"
                  },
                  "rotation": {
                     "type": "number"
                  },
                  "tags": {
                     "type": "array",
                     "items": {
                        "type": "string"
                     }
                  },
                  "triggers": {
                     "type": "array",
                     "items": {
                        "type": "object",
                        "properties": {
                           "anchor": {
                              "$ref": "./vector.schema.json"
                           },
                           "args": {
                              "type": "array",
                              "items": {
                                 "type": "string"
                              }
                           },
                           "name": {
                              "type": "string"
                           },
                           "position": {
                              "$ref": "./vector.schema.json"
                           },
                           "rotation": {
                              "type": "number"
                           },
                           "size": {
                              "$ref": "./vector.schema.json"
                           }
                        }
                     }
                  }
               }
            }
         }
      },
      "metadata": {
         "type": "object"
      },
      "mixins": {
         "type": "object",
         "additionalProperties": {
            "type": "string"
         }
      },
      "neighbors": {
         "type": "array",
         "items": {
            "type": "string"
         }
      },
      "preload": {
         "type": "array",
         "items": {
            "type": "string"
         }
      },
      "region": {
         "type": "array",
         "minItems": 2,
         "maxItems": 2,
         "items": {
            "$ref": "./vector.schema.json",
            "required": [
               "x",
               "y"
            ]
         }
      },
      "score": {
         "type": "object",
         "properties": {
            "filter": {
               "type": "number"
            },
            "gain": {
               "type": "number"
            },
            "music": {
               "type": "string"
            },
            "rate": {
               "type": "number"
            },
            "reverb": {
               "type": "number"
            }
         }
      },
      "spawn": {
         "$ref": "./vector.schema.json",
         "required": [
            "x",
            "y"
         ]
      }
   }
}
