{
   "$schema": "./room.schema.json",
   "background": "below",
   "preload": [
      "amGenerator",
      "iooFSteam"
   ],
   "layers": {
      "below": [
         {
            "position": {
               "x": 0,
               "y": 0
            },
            "barriers": [
               {
                  "position": {
                     "x": 0,
                     "y": 60
                  },
                  "size": {
                     "x": 20,
                     "y": 60
                  }
               },
               {
                  "position": {
                     "x": 20,
                     "y": 80
                  },
                  "size": {
                     "x": 100,
                     "y": -20
                  }
               },
               {
                  "position": {
                     "x": 200,
                     "y": 60
                  },
                  "size": {
                     "x": 100,
                     "y": 20
                  }
               },
               {
                  "position": {
                     "x": 0,
                     "y": 180
                  },
                  "size": {
                     "x": 20,
                     "y": 40
                  }
               },
               {
                  "position": {
                     "x": 20,
                     "y": 220
                  },
                  "size": {
                     "x": 100,
                     "y": 20
                  }
               },
               {
                  "position": {
                     "x": 200,
                     "y": 220
                  },
                  "size": {
                     "x": 100,
                     "y": 20
                  }
               },
               {
                  "position": {
                     "x": 300,
                     "y": 80
                  },
                  "size": {
                     "x": 20,
                     "y": 40
                  }
               },
               {
                  "position": {
                     "x": 300,
                     "y": 180
                  },
                  "size": {
                     "x": 20,
                     "y": 40
                  }
               }
            ],
            "triggers": [
               {
                  "position": {
                     "x": 5,
                     "y": 120
                  },
                  "size": {
                     "x": -20,
                     "y": 60
                  },
                  "name": "teleport",
                  "args": [
                     "f_muffet",
                     "left",
                     "1020",
                     "170"
                  ]
               },
               {
                  "position": {
                     "x": 120,
                     "y": 80
                  },
                  "size": {
                     "x": 80,
                     "y": -20
                  },
                  "name": "teleport",
                  "args": [
                     "f_piano",
                     "up",
                     "160",
                     "230"
                  ]
               },
               {
                  "position": {
                     "x": 120,
                     "y": 235
                  },
                  "size": {
                     "x": 80,
                     "y": 20
                  },
                  "name": "teleport",
                  "args": [
                     "f_statue",
                     "down",
                     "200",
                     "90"
                  ]
               },
               {
                  "position": {
                     "x": 315,
                     "y": 120
                  },
                  "size": {
                     "x": 20,
                     "y": 60
                  },
                  "name": "teleport",
                  "args": [
                     "f_path",
                     "right",
                     "20",
                     "410"
                  ]
               }
            ]
         },
         {
            "tags": [
               "steamgap"
            ],
            "interacts": [
               {
                  "position": {
                     "x": 140,
                     "y": 100
                  },
                  "size": {
                     "x": 40,
                     "y": 100
                  }
               },
               {
                  "position": {
                     "x": 120,
                     "y": 120
                  },
                  "size": {
                     "x": 80,
                     "y": 60
                  }
               }
            ]
         }
      ],
      "main": [
         {
            "attachments": [
               {
                  "active": true,
                  "type": "animation",
                  "anchor": {
                     "x": 0,
                     "y": 0
                  },
                  "resources": "iooSavePoint",
                  "position": {
                     "x": 0,
                     "y": -10
                  }
               }
            ],
            "interacts": [
               {
                  "name": "save",
                  "position": {
                     "x": -10
                  },
                  "size": {
                     "x": 20,
                     "y": -10
                  }
               }
            ],
            "barriers": [
               {
                  "position": {
                     "x": -10
                  },
                  "size": {
                     "x": 20,
                     "y": -10
                  }
               }
            ],
            "position": {
               "x": 115,
               "y": 90
            },
            "tags": [
               "spawn"
            ]
         },
         {
            "tags": [
               "vending_machine"
            ],
            "position": {
               "x": 66,
               "y": 90
            },
            "attachments": [
               {
                  "type": "animation",
                  "active": true,
                  "resources": "iooFVendingMachine",
                  "anchor": {
                     "y": 1
                  }
               }
            ],
            "barriers": [
               {
                  "size": {
                     "y": -13,
                     "x": 28
                  }
               }
            ],
            "interacts": [
               {
                  "name": "foundry",
                  "size": {
                     "y": -13,
                     "x": 28
                  },
                  "args": [
                     "candy"
                  ]
               }
            ]
         },
         {
            "tags": [
               "dimbox"
            ],
            "attachments": [
               {
                  "type": "animation",
                  "resources": "iooDimbox",
                  "position": {
                     "x": 0,
                     "y": 0
                  },
                  "anchor": {
                     "x": 0,
                     "y": 1
                  }
               }
            ],
            "position": {
               "x": 240,
               "y": 90
            },
            "barriers": [
               {
                  "anchor": {
                     "x": 0,
                     "y": 1
                  },
                  "position": {
                     "x": 0,
                     "y": 0
                  },
                  "size": {
                     "x": -20,
                     "y": 9
                  }
               }
            ],
            "interacts": [
               {
                  "anchor": {
                     "x": 0,
                     "y": 1
                  },
                  "size": {
                     "x": -20,
                     "y": 9
                  },
                  "name": "starton",
                  "args": [
                     "dimbox"
                  ]
               }
            ]
         },
         {
            "attachments": [
               {
                  "type": "sprite",
                  "frames": [
                     "iooFSign"
                  ],
                  "anchor": {
                     "x": 0,
                     "y": 1
                  },
                  "position": {
                     "x": 0,
                     "y": 0
                  }
               }
            ],
            "barriers": [
               {
                  "anchor": {
                     "x": 0,
                     "y": -1
                  },
                  "size": {
                     "x": -20,
                     "y": -5
                  }
               }
            ],
            "position": {
               "x": 215,
               "y": 91
            },
            "interacts": [
               {
                  "anchor": {
                     "x": 0,
                     "y": 1
                  },
                  "size": {
                     "x": 20,
                     "y": 5
                  },
                  "name": "trivia",
                  "args": [
                     "f_doge_sign"
                  ]
               }
            ]
         }
      ]
   },
   "region": [
      {
         "x": 160,
         "y": 120
      },
      {
         "x": 160,
         "y": 120
      }
   ],
   "score": {
      "music": "generator",
      "gain": 1
   },
   "neighbors": [
      "f_piano",
      "f_path",
      "f_statue",
      "f_muffet"
   ]
}