{
   "$schema": "./room.schema.json",
   "background": "below",
   "metadata": {
      "dark03": true
   },
   "preload": [
      "amMall",
      "amYouscreweduppal",
      "#aerialis-b-dark",
      "iooAShowglow",
      "amOpera",
      "amOperaAlt",
      "asBad",
      "iocMettatonDressPull",
      "iocMettatonDressIdle",
      "iocMettatonDressRoll",
      "idcAlphys",
      "avAlphys",
      "iocAlphys",
      "avMettaton",
      "asBoom",
      "iooASakuraLeaf",
      "iocMettaton",
      "iocMettatonShrug",
      "asCymbal",
      "iooADeadLeaf",
      "iocAsrielEarTugWater",
      "iocAsrielEarTug"
   ],
   "layers": {
      "below": [
         {
            "barriers": [
               {
                  "position": {
                     "x": 0,
                     "y": 200
                  },
                  "size": {
                     "x": 80,
                     "y": -20
                  }
               },
               {
                  "position": {
                     "x": 80,
                     "y": 180
                  },
                  "size": {
                     "x": 320,
                     "y": -20
                  }
               },
               {
                  "position": {
                     "x": 400,
                     "y": 180
                  },
                  "size": {
                     "x": 80,
                     "y": 20
                  }
               },
               {
                  "position": {
                     "x": 480,
                     "y": 280
                  },
                  "size": {
                     "x": -480,
                     "y": 20
                  }
               }
            ],
            "triggers": [
               {
                  "position": {
                     "x": -15,
                     "y": 200
                  },
                  "size": {
                     "x": 20,
                     "y": 80
                  },
                  "name": "teleport",
                  "args": [
                     "a_elevator4",
                     "left",
                     "340",
                     "260"
                  ]
               },
               {
                  "position": {
                     "x": 475,
                     "y": 200
                  },
                  "size": {
                     "x": 20,
                     "y": 80
                  },
                  "name": "teleport",
                  "args": [
                     "a_aftershow",
                     "right",
                     "20",
                     "160"
                  ]
               }
            ],
            "position": {
               "x": 0,
               "y": -60
            },
            "attachments": [
               {
                  "type": "animation",
                  "resources": "iooAReccolumn",
                  "active": true,
                  "anchor": {
                     "x": 0,
                     "y": -1
                  },
                  "position": {
                     "x": 450,
                     "y": 120
                  }
               },
               {
                  "type": "animation",
                  "resources": "iooAReccolumn",
                  "active": true,
                  "anchor": {
                     "x": 0,
                     "y": -1
                  },
                  "position": {
                     "x": 30,
                     "y": 120
                  }
               }
            ]
         }
      ]
   },
   "score": {
      "music": "mall",
      "gain": 1
   },
   "neighbors": [
      "a_elevator4",
      "a_aftershow"
   ],
   "region": [
      {
         "x": 160,
         "y": 140
      },
      {
         "x": 320,
         "y": 140
      }
   ]
}