{
   "$schema": "./room.schema.json",
   "background": "below",
   "layers": {
      "below": [
         {
            "barriers": [
               {
                  "position": {
                     "x": 80,
                     "y": 0
                  },
                  "size": {
                     "x": 220,
                     "y": 520
                  }
               },
               {
                  "position": {
                     "x": 20,
                     "y": 520
                  },
                  "size": {
                     "x": 20,
                     "y": -20
                  }
               },
               {
                  "position": {
                     "x": 0,
                     "y": 520
                  },
                  "size": {
                     "x": 20,
                     "y": 40
                  }
               },
               {
                  "position": {
                     "x": 380,
                     "y": 0
                  },
                  "size": {
                     "x": 20,
                     "y": 560
                  }
               },
               {
                  "position": {
                     "x": 20,
                     "y": 560
                  },
                  "size": {
                     "x": 360,
                     "y": 20
                  }
               }
            ],
            "triggers": [
               {
                  "position": {
                     "x": 40,
                     "y": 520
                  },
                  "size": {
                     "x": 40,
                     "y": -20
                  },
                  "name": "teleport",
                  "args": [
                     "a_citadelevator",
                     "up",
                     "160",
                     "230"
                  ]
               },
               {
                  "position": {
                     "x": 300,
                     "y": 5
                  },
                  "size": {
                     "x": 80,
                     "y": -20
                  },
                  "name": "teleport",
                  "args": [
                     "a_core_entry2",
                     "up",
                     "160",
                     "510"
                  ]
               }
            ],
            "attachments": [
               {
                  "type": "animation",
                  "resources": "iooACorecolumn",
                  "active": true,
                  "anchor": {
                     "x": 0,
                     "y": -1
                  },
                  "position": {
                     "x": 270,
                     "y": 460
                  }
               },
               {
                  "type": "animation",
                  "resources": "iooACorecolumn",
                  "active": true,
                  "anchor": {
                     "x": 0,
                     "y": -1
                  },
                  "position": {
                     "x": 230,
                     "y": 460
                  }
               }
            ],
            "interacts": [
               {
                  "position": {
                     "x": 160,
                     "y": 500
                  },
                  "size": {
                     "x": 40,
                     "y": 20
                  },
                  "name": "trivia",
                  "args": [
                     "coresign1"
                  ]
               }
            ]
         },
         {
            "tags": [
               "hexfloor"
            ],
            "interacts": [
               {
                  "position": {
                     "x": 300,
                     "y": 0
                  },
                  "size": {
                     "x": 80,
                     "y": 560
                  }
               },
               {
                  "position": {
                     "x": 20,
                     "y": 520
                  },
                  "size": {
                     "x": 280,
                     "y": 40
                  }
               }
            ]
         }
      ],
      "main": [
         {
            "attachments": [
               {
                  "active": true,
                  "type": "animation",
                  "anchor": {
                     "x": 0,
                     "y": 0
                  },
                  "resources": "iooSavePoint",
                  "position": {
                     "y": -10,
                     "x": 0
                  }
               }
            ],
            "interacts": [
               {
                  "name": "save",
                  "position": {
                     "x": -10
                  },
                  "size": {
                     "x": 20,
                     "y": -10
                  }
               }
            ],
            "barriers": [
               {
                  "position": {
                     "x": -10
                  },
                  "size": {
                     "x": 20,
                     "y": -10
                  }
               }
            ],
            "position": {
               "x": 100,
               "y": 530
            },
            "tags": [
               "spawn"
            ]
         }
      ]
   },
   "preload": [
      "amCore",
      "amYouscreweduppal",
      "#aerialis-b-dark",
      "avAlphys",
      "idcAlphys",
      "ionADarkman",
      "iooAFloorsegment",
      "asShatter"
   ],
   "score": {
      "music": "CORE",
      "gain": 1
   },
   "neighbors": [
      "a_citadelevator",
      "a_core_entry2"
   ],
   "region": [
      {
         "x": 160,
         "y": 120
      },
      {
         "x": 340,
         "y": 460
      }
   ]
}